<?xml version="1.0"?>
<!--
    MageMe EU Withdrawal — Annex I, Directive 2011/83/EU, official text.
    Source: EUR-Lex CELEX 32011L0083, language version EL.
    Placeholder tokens ({period_days}, {merchant_name}, etc.) are module-
    inserted; the textual matter is the verbatim EU-published translation.
-->
<config xmlns:xsi="http://www.w3.org/2001/XMLSchema-instance"
        xsi:noNamespaceSchemaLocation="urn:magento:module:MageMe_EUWithdrawal:etc/precontract.xsd">
    <annex_ia>
        <section id="right_of_withdrawal">Δικαιούστε να υπαναχωρήσετε από την παρούσα σύμβαση εντός {period_days} ημερών χωρίς να δώσετε οποιαδήποτε εξήγηση.</section>
        <section id="period_start">Η προθεσμία υπαναχώρησης λήγει {period_days} ημέρες από την επομένη της ημέρας που εσείς αποκτήσατε ή ένας τρίτος διάφορος του μεταφορέα και υποδειχθείς από εσάς απέκτησε τη φυσική κατοχή των αγαθών. Σε περίπτωση ψηφιακού περιεχομένου που δεν παραδίδεται επί υλικού μέσου, η προθεσμία λήγει 14 ημέρες από τη σύναψη της σύμβασης (εκτός εάν παραιτηθήκατε από αυτό το δικαίωμα κατά την ολοκλήρωση της παραγγελίας).</section>
        <section id="how_to_exercise">Προκειμένου να ασκήσετε το δικαίωμα υπαναχώρησης, οφείλετε να μας — {merchant_name}, {merchant_address}, {merchant_phone}, {merchant_email} — ενημερώσετε για την απόφασή σας να υπαναχωρήσετε από την παρούσα σύμβαση με μια ξεκάθαρη δήλωση (π.χ. επιστολή που θα σταλεί με ταχυδρομείο, φαξ ή ηλεκτρονικό ταχυδρομείο). Μπορείτε να χρησιμοποιήσετε το παρακάτω υπόδειγμα εντύπου υπαναχώρησης, χωρίς τούτο να είναι υποχρεωτικό.</section>
        <section id="effects">Εάν υπαναχωρήσετε από την παρούσα σύμβαση, θα σας επιστρέψουμε όλα τα χρήματα που λάβαμε από εσάς, συμπεριλαμβανομένων των εξόδων τυποποιημένης παράδοσης (εξαιρουμένων των συμπληρωματικών εξόδων που οφείλονται στη δική σας επιλογή να χρησιμοποιηθεί τρόπος παράδοσης άλλος από τον φθηνότερο τυποποιημένο τρόπο παράδοσης που εμείς προσφέρουμε), χωρίς αδικαιολόγητη καθυστέρηση και οπωσδήποτε εντός 14 ημερών από την ημέρα που θα πληροφορηθούμε την απόφασή σας να υπαναχωρήσετε από την παρούσα σύμβαση. Θα εκτελέσουμε την επιστροφή χρημάτων χρησιμοποιώντας το ίδιο μέσο πληρωμής που εσείς χρησιμοποιήσατε για την αρχική συναλλαγή.</section>
        <section id="return_address">Τα αγαθά πρέπει να επιστραφούν στη διεύθυνση: {merchant_return_address}</section>
    </annex_ia>
    <annex_ib>ΥΠΟΔΕΙΓΜΑ ΕΝΤΥΠΟΥ ΥΠΑΝΑΧΩΡΗΣΗΣ
(συμπληρώστε και επιστρέψτε το παρόν έντυπο μόνο εάν επιθυμείτε να υπαναχωρήσετε από τη σύμβαση)

— Προς: {merchant_name}, {merchant_address}, {merchant_phone}, {merchant_email}

— Γνωστοποιώ/Γνωστοποιούμε (*) με την παρούσα ότι υπαναχωρώ/υπαναχωρούμε (*) από τη σύμβασή μου/μας (*) πώλησης των ακόλουθων αγαθών (*)/παροχής της ακόλουθης υπηρεσίας (*):

— Που παραγγέλθηκε(-αν) στις (*)/που παρελήφθη(-σαν) στις (*):

— Όνομα καταναλωτή(-ών):

— Διεύθυνση καταναλωτή(-ών):

— Υπογραφή καταναλωτή(-ών) (μόνο εάν το παρόν έντυπο κοινοποιηθεί σε χαρτί):

— Ημερομηνία:

(*) Διαγράφεται η περιττή ένδειξη.

—
Αυτό είναι το επίσημο υπόδειγμα εντύπου υπαναχώρησης που προβλέπεται από το παράρτημα I στοιχείο Β της οδηγίας 2011/83/ΕΕ. Η χρήση του εντύπου αυτού είναι ΠΡΟΑΙΡΕΤΙΚΗ — μπορείτε επίσης να μας γνωστοποιήσετε την απόφασή σας να υπαναχωρήσετε με οποιαδήποτε άλλη ξεκάθαρη δήλωση (επιστολή, φαξ ή ηλεκτρονικό ταχυδρομείο) που αποστέλλεται στα παραπάνω στοιχεία επικοινωνίας.</annex_ib>
</config>
